<?xml version="1.0" encoding="UTF-8"?>
<bsi:ingestBrowseResponse xsi:schemaLocation="http://ngeo.eo.esa.int/schema/browse/ingestion ../ngEOBrowseIngestionService.xsd"
xmlns:bsi="http://ngeo.eo.esa.int/schema/browse/ingestion" xmlns:xsi="http://www.w3.org/2001/XMLSchema-instance">
    <bsi:status>success</bsi:status>
    <bsi:ingestionSummary>
        <bsi:toBeReplaced>1</bsi:toBeReplaced>
        <bsi:actuallyInserted>1</bsi:actuallyInserted>
        <bsi:actuallyReplaced>0</bsi:actuallyReplaced>
    </bsi:ingestionSummary>
    <bsi:ingestionResult>
        <bsi:briefRecord>
            <bsi:identifier>ASAR</bsi:identifier>
            <bsi:status>success</bsi:status>
        </bsi:briefRecord>
    </bsi:ingestionResult>
</bsi:ingestBrowseResponse>

